[
  {
    "article_title": "Contracts For Dec. 1, 2025",
    "article_date": "2025-12-01",
    "article_url": "https://www.war.gov/News/Contracts/Contract/Article/4345564/",
    "vendorName": "Akima Facilities Operations LLC",
    "vendorLocation": "Herndon, Virginia",
    "vendorCity": "Herndon",
    "vendorState": "Virginia",
    "awardAmount": 184882445,
    "awardAmountText": "$184,882,445",
    "contractDescription": "Akima Facilities Operations LLC, Herndon, Virginia, was awarded a firm-fixed-price, labor hours, and time-and-materials contract to support the repair, reset, and recapitalization of military equipment. The amount of this action is $184,882,445. Bids were solicited via the internet with two received. Work locations and funding will be determined with each order, with an estimated completion date of May 31, 2029. Army Contracting Command, Letterkenny Army Depot, Pennsylvania, is the contracting activity (W911N2-26-F-A049).",
    "serviceBranch": "ARMY",
    "isSmallBusiness": false,
    "rawParagraph": "Akima Facilities Operations LLC, Herndon, Virginia, was awarded a firm-fixed-price, labor hours, and time-and-materials contract to support the repair, reset, and recapitalization of military equipment. The amount of this action is $184,882,445. Bids were solicited via the internet with two received. Work locations and funding will be determined with each order, with an estimated completion date of May 31, 2029. Army Contracting Command, Letterkenny Army Depot, Pennsylvania, is the contracting activity (W911N2-26-F-A049).",
    "parsingConfidence": 0.9,
    "contractTypes": [
      "firm-fixed-price",
      "time-and-materials"
    ],
    "isIDIQ": false,
    "isMultipleAward": false,
    "isHybridContract": false,
    "isCompeted": null,
    "isSmallBusinessSetAside": false,
    "isModification": false,
    "isOptionExercise": false
  },
  {
    "article_title": "Contracts For Dec. 1, 2025",
    "article_date": "2025-12-01",
    "article_url": "https://www.war.gov/News/Contracts/Contract/Article/4345564/",
    "vendorName": "State of Oregon Department of Fish and Wildlife",
    "vendorLocation": "Salem, Oregon",
    "vendorCity": "Salem",
    "vendorState": "Oregon",
    "awardAmount": 99000000,
    "awardAmountText": "$99,000,000",
    "contractDescription": "State of Oregon Department of Fish and Wildlife, Salem, Oregon, was awarded a firm-fixed-price to operate and maintain fish hatcheries for the production and release of salmonids in the Columbia, Willamette, and Rogue River Basins, and to conduct research, monitoring, and evaluations of bull trout in the Willamette River Basin. The amount of this action is $99,000,000. Bids were solicited via the internet with one received. Work locations and funding will be determined with each order, with an estimated completion date of Nov. 29, 2030. U.S. Army Corps of Engineers, Portland District, is the contracting activity (W9127N-26-D-A002).",
    "serviceBranch": "ARMY",
    "isSmallBusiness": false,
    "rawParagraph": "State of Oregon Department of Fish and Wildlife, Salem, Oregon, was awarded a firm-fixed-price to operate and maintain fish hatcheries for the production and release of salmonids in the Columbia, Willamette, and Rogue River Basins, and to conduct research, monitoring, and evaluations of bull trout in the Willamette River Basin. The amount of this action is $99,000,000. Bids were solicited via the internet with one received. Work locations and funding will be determined with each order, with an estimated completion date of Nov. 29, 2030. U.S. Army Corps of Engineers, Portland District, is the contracting activity (W9127N-26-D-A002).",
    "parsingConfidence": 0.9,
    "contractTypes": [
      "firm-fixed-price"
    ],
    "isIDIQ": false,
    "isMultipleAward": false,
    "isHybridContract": false,
    "isCompeted": null,
    "isSmallBusinessSetAside": false,
    "isModification": false,
    "isOptionExercise": false
  },
  {
    "article_title": "Contracts For Dec. 1, 2025",
    "article_date": "2025-12-01",
    "article_url": "https://www.war.gov/News/Contracts/Contract/Article/4345564/",
    "vendorName": "Lockheed Martin Corp.",
    "vendorLocation": "Grand Prairie, Texas",
    "vendorCity": "Grand Prairie",
    "vendorState": "Texas",
    "awardAmount": 52000000,
    "awardAmountText": "$52,000,000",
    "contractDescription": "Lockheed Martin Corp., Grand Prairie, Texas, was awarded a $52,000,000 cost-plus-fixed-fee, firm-fixed-price contract for maintaining and operating and configuration of the High Mobility Artillery Rocket System, Multiple Launch Rocket System Launcher Fleet, and the respective repair parts storage and distribution center. Bids were solicited via the internet with one received. Work will be performed in Grand Prairie, Texas, with an estimated completion date of May 14, 2031. Fiscal 2025 procurement, Army funds in the amount of $342,393, $1,412,854, and $2,189,923, were obligated at the time of the award. Army Contracting Command, Redstone Arsenal, Alabama, is the contracting activity (W31P4Q-26-C-0007).",
    "serviceBranch": "ARMY",
    "isSmallBusiness": false,
    "rawParagraph": "Lockheed Martin Corp., Grand Prairie, Texas, was awarded a $52,000,000 cost-plus-fixed-fee, firm-fixed-price contract for maintaining and operating and configuration of the High Mobility Artillery Rocket System, Multiple Launch Rocket System Launcher Fleet, and the respective repair parts storage and distribution center. Bids were solicited via the internet with one received. Work will be performed in Grand Prairie, Texas, with an estimated completion date of May 14, 2031. Fiscal 2025 procurement, Army funds in the amount of $342,393, $1,412,854, and $2,189,923, were obligated at the time of the award. Army Contracting Command, Redstone Arsenal, Alabama, is the contracting activity (W31P4Q-26-C-0007).",
    "parsingConfidence": 0.9,
    "contractTypes": [
      "firm-fixed-price",
      "cost-plus-fixed-fee"
    ],
    "isIDIQ": false,
    "isMultipleAward": false,
    "isHybridContract": false,
    "isCompeted": null,
    "isSmallBusinessSetAside": false,
    "isModification": false,
    "isOptionExercise": false
  },
  {
    "article_title": "Contracts For Dec. 1, 2025",
    "article_date": "2025-12-01",
    "article_url": "https://www.war.gov/News/Contracts/Contract/Article/4345564/",
    "vendorName": "AECOM International Inc.",
    "vendorLocation": "Lynchburg, Virginia",
    "vendorCity": "Lynchburg",
    "vendorState": "Virginia",
    "awardAmount": 45000000,
    "awardAmountText": "$45,000,000",
    "contractDescription": "AECOM International Inc., Frankfurt am Main, Germany (W912GB-26-D-0017); AE Alliance JV, Lynchburg, Virginia (W912GB-26-D-0018); Alberto Izzo & Partners SRL, Napoli, Italy (W912GB-26-D-0019); CDM Federal Services Europe JV, Bickenbach, Germany (W912GB-26-D-0020); HDR-Stanley Italy IDC JV, Omaha, Nebraska (W912GB-26-D-0021); and WSP USA Solutions Inc., Washington, D.C. (W912GB-26-D-0022), will compete for each order of the $45,000,000 firm-fixed-price contract for architecture-engineering services. Bids were solicited via the internet with 16 received. Work locations and funding will be determined with each order, with an estimated completion date of Dec. 31, 2030. U.S. Army Corps of Engineers, Europe District, is the contracting activity.",
    "serviceBranch": "ARMY",
    "isSmallBusiness": false,
    "rawParagraph": "AECOM International Inc., Frankfurt am Main, Germany (W912GB-26-D-0017); AE Alliance JV, Lynchburg, Virginia (W912GB-26-D-0018); Alberto Izzo & Partners SRL, Napoli, Italy (W912GB-26-D-0019); CDM Federal Services Europe JV, Bickenbach, Germany (W912GB-26-D-0020); HDR-Stanley Italy IDC JV, Omaha, Nebraska (W912GB-26-D-0021); and WSP USA Solutions Inc., Washington, D.C. (W912GB-26-D-0022), will compete for each order of the $45,000,000 firm-fixed-price contract for architecture-engineering services. Bids were solicited via the internet with 16 received. Work locations and funding will be determined with each order, with an estimated completion date of Dec. 31, 2030. U.S. Army Corps of Engineers, Europe District, is the contracting activity.",
    "parsingConfidence": 0.9,
    "contractTypes": [
      "firm-fixed-price"
    ],
    "isIDIQ": false,
    "isMultipleAward": false,
    "isHybridContract": false,
    "isCompeted": null,
    "isSmallBusinessSetAside": false,
    "isModification": false,
    "isOptionExercise": false
  },
  {
    "article_title": "Contracts For Dec. 1, 2025",
    "article_date": "2025-12-01",
    "article_url": "https://www.war.gov/News/Contracts/Contract/Article/4345564/",
    "vendorName": "AECOM International Inc.",
    "vendorLocation": "Napoli, Italy",
    "vendorCity": "Napoli",
    "vendorState": "Italy",
    "awardAmount": 45000000,
    "awardAmountText": "$45,000,000",
    "contractDescription": "AECOM International Inc., Frankfurt am Main, Germany (W912GB-26-D-0012); Alberto Izzo & Partners-Benham Design, Napoli, Italy (W912GB-26-D-0013); HDR-Stanley Italy IDC JV, Omaha, Nebraska (W912GB-26-D-0014); and CDM Federal Services Europe JV, Bickenbach, Germany (W912GB-26-D-0015), will compete for each order of the $45,000,000 firm-fixed-price contract for architecture-engineering services. Bids were solicited via the internet with 13 received. Work locations and funding will be determined with each order, with an estimated completion date of Dec. 31, 2030. U.S. Army Corps of Engineers, Europe District, is the contracting activity.",
    "serviceBranch": "ARMY",
    "isSmallBusiness": false,
    "rawParagraph": "AECOM International Inc., Frankfurt am Main, Germany (W912GB-26-D-0012); Alberto Izzo & Partners-Benham Design, Napoli, Italy (W912GB-26-D-0013); HDR-Stanley Italy IDC JV, Omaha, Nebraska (W912GB-26-D-0014); and CDM Federal Services Europe JV, Bickenbach, Germany (W912GB-26-D-0015), will compete for each order of the $45,000,000 firm-fixed-price contract for architecture-engineering services. Bids were solicited via the internet with 13 received. Work locations and funding will be determined with each order, with an estimated completion date of Dec. 31, 2030. U.S. Army Corps of Engineers, Europe District, is the contracting activity.",
    "parsingConfidence": 0.9,
    "contractTypes": [
      "firm-fixed-price"
    ],
    "isIDIQ": false,
    "isMultipleAward": false,
    "isHybridContract": false,
    "isCompeted": null,
    "isSmallBusinessSetAside": false,
    "isModification": false,
    "isOptionExercise": false
  },
  {
    "article_title": "Contracts For Dec. 1, 2025",
    "article_date": "2025-12-01",
    "article_url": "https://www.war.gov/News/Contracts/Contract/Article/4345564/",
    "vendorName": "Federal Contracting Inc.",
    "vendorLocation": "Colorado Springs, Colorado",
    "vendorCity": "Colorado Springs",
    "vendorState": "Colorado",
    "awardAmount": 42430433,
    "awardAmountText": "$42,430,433",
    "contractDescription": "Federal Contracting Inc., Colorado Springs, Colorado, was awarded a firm-fixed-price contract to construct a large child development center utilizing the standard facility design, including areas for infants through preschoolers, administrative and public spaces, kitchen, playgrounds, and all supporting site work and utilities. The amount of this action is $42,430,433. Bids were solicited via web with 11 received. Work will be performed in San Antonio, Texas, with an estimated completion date of Nov. 9, 2027. Fiscal 2026 military construction, defense-wide funds in the amount of $42,430,433 were obligated at the time of the award. U.S. Army Corps of Engineers, Fort Worth District, is the contracting activity (W9126G-26-C-0003).",
    "serviceBranch": "ARMY",
    "isSmallBusiness": false,
    "rawParagraph": "Federal Contracting Inc., Colorado Springs, Colorado, was awarded a firm-fixed-price contract to construct a large child development center utilizing the standard facility design, including areas for infants through preschoolers, administrative and public spaces, kitchen, playgrounds, and all supporting site work and utilities. The amount of this action is $42,430,433. Bids were solicited via web with 11 received. Work will be performed in San Antonio, Texas, with an estimated completion date of Nov. 9, 2027. Fiscal 2026 military construction, defense-wide funds in the amount of $42,430,433 were obligated at the time of the award. U.S. Army Corps of Engineers, Fort Worth District, is the contracting activity (W9126G-26-C-0003).",
    "parsingConfidence": 0.9,
    "contractTypes": [
      "firm-fixed-price"
    ],
    "isIDIQ": false,
    "isMultipleAward": false,
    "isHybridContract": false,
    "isCompeted": null,
    "isSmallBusinessSetAside": false,
    "isModification": false,
    "isOptionExercise": false
  },
  {
    "article_title": "Contracts For Dec. 1, 2025",
    "article_date": "2025-12-01",
    "article_url": "https://www.war.gov/News/Contracts/Contract/Article/4345564/",
    "vendorName": "Kokosing Alberici Traylor LLC",
    "vendorLocation": "Westerville, Ohio",
    "vendorCity": "Westerville",
    "vendorState": "Ohio",
    "awardAmount": 30234166,
    "awardAmountText": "$30,234,166",
    "contractDescription": "Kokosing Alberici Traylor LLC, Westerville, Ohio, was awarded a $30,234,166 modification (P00022) to contract W911XK-22-C-0006 for an in-scope change to the New Lock Chamber project, which involves constructing a 1,200-foot-long, 110-foot-wide chamber in Sault Saint Marie, Michigan. The modification brings the total cumulative face value of the contract to $1,921,322,786.65. Work will be performed in Sault Saint Marie, Michigan, with an estimated completion date of July 9, 2029. Fiscal 2019, 2020, 2021, 2022, 2023, and 2025 construction, Corps of Engineers, civil funds in the amount of $2,022,868, $3,046, $21,699, $3,105,155, $360,637.15, and $24,720,760, were obligated at the time of the award. U.S. Army Corps of Engineers, Detroit District, is the contracting activity.",
    "serviceBranch": "ARMY",
    "isSmallBusiness": false,
    "rawParagraph": "Kokosing Alberici Traylor LLC, Westerville, Ohio, was awarded a $30,234,166 modification (P00022) to contract W911XK-22-C-0006 for an in-scope change to the New Lock Chamber project, which involves constructing a 1,200-foot-long, 110-foot-wide chamber in Sault Saint Marie, Michigan. The modification brings the total cumulative face value of the contract to $1,921,322,786.65. Work will be performed in Sault Saint Marie, Michigan, with an estimated completion date of July 9, 2029. Fiscal 2019, 2020, 2021, 2022, 2023, and 2025 construction, Corps of Engineers, civil funds in the amount of $2,022,868, $3,046, $21,699, $3,105,155, $360,637.15, and $24,720,760, were obligated at the time of the award. U.S. Army Corps of Engineers, Detroit District, is the contracting activity.",
    "parsingConfidence": 0.85,
    "isIDIQ": false,
    "isMultipleAward": false,
    "isHybridContract": false,
    "isCompeted": null,
    "isSmallBusinessSetAside": false,
    "isModification": false,
    "isOptionExercise": false
  },
  {
    "article_title": "Contracts For Dec. 1, 2025",
    "article_date": "2025-12-01",
    "article_url": "https://www.war.gov/News/Contracts/Contract/Article/4345564/",
    "vendorName": "Interdyne Corp.",
    "vendorLocation": "Cornelius, North Carolina",
    "vendorCity": "Cornelius",
    "vendorState": "North Carolina",
    "awardAmount": 9777722,
    "awardAmountText": "$9,777,722",
    "contractDescription": "Interdyne Corp.,* Cornelius, North Carolina, was awarded a firm-fixed-price contract for providing preventative maintenance, corrective maintenance and ancillary actions to the Egyptian Armament Air Defense facilities. The amount of this action is $9,777,722. Bids were solicited with one received. Work will be performed in Cario, Egypt, with an estimated completion date of July 16, 2029. Fiscal 2010 Foreign Military Sales (Egypt) funds in the amount of $9,777,722 were obligated at the time of the award. U.S. Army Corps of Engineers, Middle East District, is the contracting activity (W912ER-26-C-A001).",
    "serviceBranch": "ARMY",
    "isSmallBusiness": false,
    "rawParagraph": "Interdyne Corp.,* Cornelius, North Carolina, was awarded a firm-fixed-price contract for providing preventative maintenance, corrective maintenance and ancillary actions to the Egyptian Armament Air Defense facilities. The amount of this action is $9,777,722. Bids were solicited with one received. Work will be performed in Cario, Egypt, with an estimated completion date of July 16, 2029. Fiscal 2010 Foreign Military Sales (Egypt) funds in the amount of $9,777,722 were obligated at the time of the award. U.S. Army Corps of Engineers, Middle East District, is the contracting activity (W912ER-26-C-A001).",
    "parsingConfidence": 0.9,
    "contractTypes": [
      "firm-fixed-price"
    ],
    "isIDIQ": false,
    "isMultipleAward": false,
    "isHybridContract": false,
    "isCompeted": null,
    "isSmallBusinessSetAside": false,
    "isModification": false,
    "isOptionExercise": false
  },
  {
    "article_title": "Contracts For Dec. 1, 2025",
    "article_date": "2025-12-01",
    "article_url": "https://www.war.gov/News/Contracts/Contract/Article/4345564/",
    "vendorName": "BAE Systems Land & Armaments LP",
    "vendorLocation": "Sterling Heights, Michigan",
    "vendorCity": "Sterling Heights",
    "vendorState": "Michigan",
    "contractNumber": "M67854-16-C-0006",
    "awardAmount": 184400905,
    "awardAmountText": "$184,400,905",
    "contractDescription": "BAE Systems Land & Armaments LP, Sterling Heights, Michigan, is awarded a $184,400,905 firm-fixed-price modification to a previously awarded contract (M67854-16-C-0006) for amphibious combat vehicles (ACV). The total value of the contract, if all options are exercised, is $3,859,806,117. This contract modification provides for the exercise of options for the procurement of 30 full rate production ACV medium caliber cannon mission role variants and associated production, fielding and support costs, and spares. Work will be performed in York, Pennsylvania (60%); Aiken, South Carolina (15%); San Jose, California (15%); Sterling Heights, Michigan (5%); and Stafford, Virginia (5%) with an expected completion date of March 2028. Fiscal 2026 procurement (Marine Corps) funds in the amount of $184,400,905 will be obligated at the time of award and will not expire at the end of the current fiscal year. Marine Corps Systems Command, Quantico, Virginia, is the contracting activity (M67854-16-C-0006).",
    "serviceBranch": "MARINE CORPS",
    "isSmallBusiness": false,
    "rawParagraph": "BAE Systems Land & Armaments LP, Sterling Heights, Michigan, is awarded a $184,400,905 firm-fixed-price modification to a previously awarded contract (M67854-16-C-0006) for amphibious combat vehicles (ACV). The total value of the contract, if all options are exercised, is $3,859,806,117. This contract modification provides for the exercise of options for the procurement of 30 full rate production ACV medium caliber cannon mission role variants and associated production, fielding and support costs, and spares. Work will be performed in York, Pennsylvania (60%); Aiken, South Carolina (15%); San Jose, California (15%); Sterling Heights, Michigan (5%); and Stafford, Virginia (5%) with an expected completion date of March 2028. Fiscal 2026 procurement (Marine Corps) funds in the amount of $184,400,905 will be obligated at the time of award and will not expire at the end of the current fiscal year. Marine Corps Systems Command, Quantico, Virginia, is the contracting activity (M67854-16-C-0006).",
    "parsingConfidence": 1,
    "contractTypes": [
      "firm-fixed-price"
    ],
    "isIDIQ": false,
    "isMultipleAward": false,
    "isHybridContract": false,
    "isCompeted": null,
    "isSmallBusinessSetAside": false,
    "isModification": true,
    "baseContractNumber": "M67854-16-C-0006",
    "isOptionExercise": false,
    "modificationType": "other modification"
  },
  {
    "article_title": "Contracts For Dec. 1, 2025",
    "article_date": "2025-12-01",
    "article_url": "https://www.war.gov/News/Contracts/Contract/Article/4345564/",
    "vendorName": "Boeing Co.",
    "vendorLocation": "Philadelphia, Pennsylvania",
    "vendorCity": "Philadelphia",
    "vendorState": "Pennsylvania",
    "contractNumber": "N00383-26-F-0YY0",
    "awardAmount": 104432672,
    "awardAmountText": "$104,432,672",
    "contractDescription": "Boeing Co., St. Louis, Missouri, was awarded $104,432,672 for a ceiling-priced delivery order (N00383-26-F-0YY0) under a previously awarded basic ordering agreement (N00383-22-G-YY01) for the repair of large are display and low profile head-up display used in the advanced cockpit system on the F/A-18 E/F and EA-18G aircraft. The delivery order does not include an option period. Work will be performed in Fort Worth, Texas (70%); Talladega, Alabama (20%); and St. Louis, Missouri (10%), and work is expected to be completed by April 2028. Fiscal 2026 working capital (Navy) funds; fiscal 2025 aircraft procurement (Navy) funds; and fiscal 2024 procurement (Air Force) funds in the amount of $53,241,552, will be obligated at the time of award as an undefinitized contract action, all funds will not expire at the end of the current fiscal year. One company was solicited for this sole-source requirement pursuant to the authority set forth in 10 U.S. Code 3204 (a)(1), with one offer received. Naval Supply Systems Command Weapon Systems Support, Philadelphia, Pennsylvania, is the contracting activity.",
    "completionDate": "2028-04-01T04:00:00.000Z",
    "serviceBranch": "NAVY",
    "isSmallBusiness": false,
    "rawParagraph": "Boeing Co., St. Louis, Missouri, was awarded $104,432,672 for a ceiling-priced delivery order (N00383-26-F-0YY0) under a previously awarded basic ordering agreement (N00383-22-G-YY01) for the repair of large are display and low profile head-up display used in the advanced cockpit system on the F/A-18 E/F and EA-18G aircraft. The delivery order does not include an option period. Work will be performed in Fort Worth, Texas (70%); Talladega, Alabama (20%); and St. Louis, Missouri (10%), and work is expected to be completed by April 2028. Fiscal 2026 working capital (Navy) funds; fiscal 2025 aircraft procurement (Navy) funds; and fiscal 2024 procurement (Air Force) funds in the amount of $53,241,552, will be obligated at the time of award as an undefinitized contract action, all funds will not expire at the end of the current fiscal year. One company was solicited for this sole-source requirement pursuant to the authority set forth in 10 U.S. Code 3204 (a)(1), with one offer received. Naval Supply Systems Command Weapon Systems Support, Philadelphia, Pennsylvania, is the contracting activity.",
    "parsingConfidence": 0.95,
    "isIDIQ": false,
    "isMultipleAward": false,
    "isHybridContract": false,
    "isCompeted": false,
    "competitionType": "sole source",
    "numberOfOffersReceived": 1,
    "isSmallBusinessSetAside": false,
    "isModification": false,
    "isOptionExercise": false
  },
  {
    "article_title": "Contracts For Dec. 1, 2025",
    "article_date": "2025-12-01",
    "article_url": "https://www.war.gov/News/Contracts/Contract/Article/4345564/",
    "vendorName": "Huntington Ingalls Industries",
    "vendorLocation": "Inc, Newport News",
    "vendorCity": "Inc",
    "vendorState": "Newport News",
    "contractNumber": "N00024-26-C-2100",
    "awardAmount": 91891302,
    "awardAmountText": "$91,891,302",
    "contractDescription": "Huntington Ingalls Industries, Inc, Newport News, Virgina, was awarded a $91,891,302 cost-plus-fixed-fee contract to provide Aircraft Carrier Engineering Support for the Nimitz-class and Gerald R. Ford-class aircraft carriers. The scope includes but is not limited to engineering, technical, design, integrated logistics support, configuration management, database management and modernization, and ship change document development. This contract includes options which, if exercised, would bring the cumulative value of this contract to $471,969,850. Work will be performed in Newport News, Virginia (96%); Portsmouth, Virginia (2%); and Bremerton, Washington (2%), and is expected to be completed by November 2030. If all options are exercised, work will continue through November 2030. Fiscal 2024 shipbuilding and conversion (Navy) funds in the amount of $10,800; fiscal 2026 operations and maintenance (Navy) funds in the amount of $4,370,000; and fiscal 2026 research, development, test and evaluation (Navy) funds in the amount of $1,300,000, will be obligated at time of award, of which $4,370,000 will expire at the end of the current fiscal year. In accordance with 10 U.S. Code 3204 (a)(1), this contract was not competitively procured (only one responsible source and no other supplies or services will satisfy agency requirements). Naval Sea Systems Command, Washington, D.C., is the contracting activity (N00024-26-C-2100).",
    "completionDate": "2030-11-01T04:00:00.000Z",
    "serviceBranch": "NAVAL SEA SYSTEMS COMMAND",
    "isSmallBusiness": false,
    "rawParagraph": "Huntington Ingalls Industries, Inc, Newport News, Virgina, was awarded a $91,891,302 cost-plus-fixed-fee contract to provide Aircraft Carrier Engineering Support for the Nimitz-class and Gerald R. Ford-class aircraft carriers. The scope includes but is not limited to engineering, technical, design, integrated logistics support, configuration management, database management and modernization, and ship change document development. This contract includes options which, if exercised, would bring the cumulative value of this contract to $471,969,850. Work will be performed in Newport News, Virginia (96%); Portsmouth, Virginia (2%); and Bremerton, Washington (2%), and is expected to be completed by November 2030. If all options are exercised, work will continue through November 2030. Fiscal 2024 shipbuilding and conversion (Navy) funds in the amount of $10,800; fiscal 2026 operations and maintenance (Navy) funds in the amount of $4,370,000; and fiscal 2026 research, development, test and evaluation (Navy) funds in the amount of $1,300,000, will be obligated at time of award, of which $4,370,000 will expire at the end of the current fiscal year. In accordance with 10 U.S. Code 3204 (a)(1), this contract was not competitively procured (only one responsible source and no other supplies or services will satisfy agency requirements). Naval Sea Systems Command, Washington, D.C., is the contracting activity (N00024-26-C-2100).",
    "parsingConfidence": 1,
    "contractTypes": [
      "cost-plus-fixed-fee"
    ],
    "isIDIQ": false,
    "isMultipleAward": false,
    "isHybridContract": false,
    "isCompeted": false,
    "competitionType": "sole source",
    "isSmallBusinessSetAside": false,
    "isModification": false,
    "isOptionExercise": false
  },
  {
    "article_title": "Contracts For Dec. 1, 2025",
    "article_date": "2025-12-01",
    "article_url": "https://www.war.gov/News/Contracts/Contract/Article/4345564/",
    "vendorName": "Total Concepts of Designs Inc.",
    "vendorLocation": "Indian Head, Maryland",
    "vendorCity": "Indian Head",
    "vendorState": "Maryland",
    "contractNumber": "N00174-26-D-0002",
    "awardAmount": 30000000,
    "awardAmountText": "$30,000,000",
    "contractDescription": "Total Concepts of Designs Inc.,* is awarded a $30,000,000 firm-fixed-price, indefinite-delivery/indefinite-quantity contract for the manufacturing of various metal parts for use in the manufacture, assembly, packaging, and shipping of All Up Round five inch projectiles and propelling charges, and the Mk14 MOD4 tank assembly. Work will be performed in Scottsburg, Indiana (60%); Cincinnati, Ohio (20%); and Hammond, Indiana (20%), and is expected to be completed by October 2030. Fiscal 2024 procurement of ammunition (Navy and Marine Corps) funds in the amount of $1,453,302 (97%); and fiscal 2025 procurement of ammunition, Navy and Marine Corps (Navy) funds in the amount of $47,220 (3%), will be obligated at time of award, of which $1,453,302 will expire at the end of the current fiscal year. This contract was competitively procured via the SAM.gov website with two offers received. Naval Surface Warfare Center Indian Head Division, Indian Head, Maryland, is the contracting activity (N00174-26-D-0002).",
    "completionDate": "2030-10-01T04:00:00.000Z",
    "serviceBranch": "NAVY",
    "isSmallBusiness": false,
    "rawParagraph": "Total Concepts of Designs Inc.,* is awarded a $30,000,000 firm-fixed-price, indefinite-delivery/indefinite-quantity contract for the manufacturing of various metal parts for use in the manufacture, assembly, packaging, and shipping of All Up Round five inch projectiles and propelling charges, and the Mk14 MOD4 tank assembly. Work will be performed in Scottsburg, Indiana (60%); Cincinnati, Ohio (20%); and Hammond, Indiana (20%), and is expected to be completed by October 2030. Fiscal 2024 procurement of ammunition (Navy and Marine Corps) funds in the amount of $1,453,302 (97%); and fiscal 2025 procurement of ammunition, Navy and Marine Corps (Navy) funds in the amount of $47,220 (3%), will be obligated at time of award, of which $1,453,302 will expire at the end of the current fiscal year. This contract was competitively procured via the SAM.gov website with two offers received. Naval Surface Warfare Center Indian Head Division, Indian Head, Maryland, is the contracting activity (N00174-26-D-0002).",
    "parsingConfidence": 1,
    "contractTypes": [
      "firm-fixed-price",
      "IDIQ"
    ],
    "isIDIQ": true,
    "isMultipleAward": false,
    "isHybridContract": false,
    "isCompeted": null,
    "numberOfOffersReceived": 2,
    "isSmallBusinessSetAside": false,
    "isModification": false,
    "isOptionExercise": false
  },
  {
    "article_title": "Contracts For Dec. 1, 2025",
    "article_date": "2025-12-01",
    "article_url": "https://www.war.gov/News/Contracts/Contract/Article/4345564/",
    "vendorName": "CGI Federal Inc.",
    "vendorLocation": "Fairfax, Virginia",
    "vendorCity": "Fairfax",
    "vendorState": "Virginia",
    "contractNumber": "M6700425F3002",
    "awardAmount": 17653994,
    "awardAmountText": "$17,653,994",
    "contractDescription": "CGI Federal Inc., Fairfax, Virginia, is awarded a $17,653,994, firm-fixed-price, with cost reimbursable travel and other direct costs, task order (M6700425F3002) under a multiple award contract (N0017819D7431) via Seaport Next Generation (NXG) for Plans and Data Support Services. This contract provides the full range and depth of logistics services and software systems support for the Marine Corps Preposition Program which includes the Maritime Preposition Forces Program, Marine Corps Preposition Program -Norway, Marine Corps Preposition Program -Philippines, and other locations to be determined in support of the future Prepositioning Network. Work will be performed at Jacksonville, Florida, with an expected completion date of Dec. 31, 2030, if all options are exercised. This task order includes a one-year base and four twelve-month option periods which, if exercised, would bring the cumulative value of this contract to $17,653,994. Fiscal 2026 operations and maintenance funds in the amount of $2,900,000 has been provided for the base year period. This contract was competitively solicited and procured via the Seaport NXG with three offers received. Blount Island Command, Jacksonville, Florida, is the contracting activity.",
    "serviceBranch": "MARINE CORPS",
    "isSmallBusiness": false,
    "rawParagraph": "CGI Federal Inc., Fairfax, Virginia, is awarded a $17,653,994, firm-fixed-price, with cost reimbursable travel and other direct costs, task order (M6700425F3002) under a multiple award contract (N0017819D7431) via Seaport Next Generation (NXG) for Plans and Data Support Services. This contract provides the full range and depth of logistics services and software systems support for the Marine Corps Preposition Program which includes the Maritime Preposition Forces Program, Marine Corps Preposition Program -Norway, Marine Corps Preposition Program -Philippines, and other locations to be determined in support of the future Prepositioning Network. Work will be performed at Jacksonville, Florida, with an expected completion date of Dec. 31, 2030, if all options are exercised. This task order includes a one-year base and four twelve-month option periods which, if exercised, would bring the cumulative value of this contract to $17,653,994. Fiscal 2026 operations and maintenance funds in the amount of $2,900,000 has been provided for the base year period. This contract was competitively solicited and procured via the Seaport NXG with three offers received. Blount Island Command, Jacksonville, Florida, is the contracting activity.",
    "parsingConfidence": 1,
    "contractTypes": [
      "firm-fixed-price"
    ],
    "isIDIQ": false,
    "isMultipleAward": true,
    "isHybridContract": false,
    "isCompeted": null,
    "numberOfOffersReceived": 3,
    "isSmallBusinessSetAside": false,
    "isModification": false,
    "isOptionExercise": false
  },
  {
    "article_title": "Contracts For Dec. 1, 2025",
    "article_date": "2025-12-01",
    "article_url": "https://www.war.gov/News/Contracts/Contract/Article/4345564/",
    "vendorName": "Delphinus Engineering Inc.",
    "vendorLocation": "Newtown, Pennsylvania",
    "vendorCity": "Newtown",
    "vendorState": "Pennsylvania",
    "contractNumber": "N00024-26-C-6103",
    "awardAmount": 14549938,
    "awardAmountText": "$14,549,938",
    "contractDescription": "Delphinus Engineering Inc.,* Newtown, Pennsylvania, is awarded a $14,549,938 cost-plus-incentive-fee contract for the development, fabrication, production, integration, and testing of the Victoria-class bow array and lift system. This contract includes options which, if exercised, would bring the cumulative value of this contract to $36,979,203. This contract involves Foreign Military Sales (FMS) to Canada (100%). Work will be performed in Newtown, Pennsylvania, and is expected to be completed by July 2030. FMS funds in the amount of $14,549,938 will be obligated at time of award and will not expire at the end of the current fiscal year. This contract was not competitively procured pursuant to 10 U.S. Code 2304 (a) (4), (International Agreement). Naval Sea Systems Command, Washington, D.C., is the contracting activity (N00024-26-C-6103).",
    "completionDate": "2030-07-01T04:00:00.000Z",
    "serviceBranch": "NAVAL SEA SYSTEMS COMMAND",
    "isSmallBusiness": false,
    "rawParagraph": "Delphinus Engineering Inc.,* Newtown, Pennsylvania, is awarded a $14,549,938 cost-plus-incentive-fee contract for the development, fabrication, production, integration, and testing of the Victoria-class bow array and lift system. This contract includes options which, if exercised, would bring the cumulative value of this contract to $36,979,203. This contract involves Foreign Military Sales (FMS) to Canada (100%). Work will be performed in Newtown, Pennsylvania, and is expected to be completed by July 2030. FMS funds in the amount of $14,549,938 will be obligated at time of award and will not expire at the end of the current fiscal year. This contract was not competitively procured pursuant to 10 U.S. Code 2304 (a) (4), (International Agreement). Naval Sea Systems Command, Washington, D.C., is the contracting activity (N00024-26-C-6103).",
    "parsingConfidence": 1,
    "contractTypes": [
      "cost-plus-incentive-fee"
    ],
    "isIDIQ": false,
    "isMultipleAward": false,
    "isHybridContract": false,
    "isCompeted": false,
    "competitionType": "sole source",
    "isSmallBusinessSetAside": false,
    "isModification": false,
    "isOptionExercise": false
  },
  {
    "article_title": "Contracts For Dec. 1, 2025",
    "article_date": "2025-12-01",
    "article_url": "https://www.war.gov/News/Contracts/Contract/Article/4345564/",
    "vendorName": "Charles Stark Draper Laboratories Inc.",
    "vendorLocation": "Cambridge, Massachusetts",
    "vendorCity": "Cambridge",
    "vendorState": "Massachusetts",
    "contractNumber": "N0003023C6008",
    "awardAmount": 9635327,
    "awardAmountText": "$9,635,327",
    "contractDescription": "Charles Stark Draper Laboratories Inc., Cambridge, Massachusetts, is being awarded a $9,635,327 cost-plus-fixed-fee modification (P00005) under a previously awarded and announced contract (N0003023C6008) for production of the Trident (D5) Guidance Subsystem.  This requirement includes design analysis, testing, procurement, and manufacturing of Alternate Pendulous Integrating Gyroscopic Accelerometer repairs and associated material. Work will be performed in Cambridge, Massachusetts (50%); Pittsfield, Massachusetts (25%); and Clearwater, Florida (25%). Work is expected to be completed Nov. 30, 2028. Fiscal 2025 Weapons Procurement (Navy) funds in the amount of $9,635,327 will be obligated at time of award. No funds will expire at the end of the current fiscal year. This contract was awarded as a sole-source acquisition pursuant to 10 U.S. Code 3204(c)(1) and was previously synopsized on the System for Award Management (SAM.gov) online portal. Strategic Systems Programs, Washington, D.C., is the contracting activity.",
    "serviceBranch": "NAVY",
    "isSmallBusiness": false,
    "rawParagraph": "Charles Stark Draper Laboratories Inc., Cambridge, Massachusetts, is being awarded a $9,635,327 cost-plus-fixed-fee modification (P00005) under a previously awarded and announced contract (N0003023C6008) for production of the Trident (D5) Guidance Subsystem.  This requirement includes design analysis, testing, procurement, and manufacturing of Alternate Pendulous Integrating Gyroscopic Accelerometer repairs and associated material. Work will be performed in Cambridge, Massachusetts (50%); Pittsfield, Massachusetts (25%); and Clearwater, Florida (25%). Work is expected to be completed Nov. 30, 2028. Fiscal 2025 Weapons Procurement (Navy) funds in the amount of $9,635,327 will be obligated at time of award. No funds will expire at the end of the current fiscal year. This contract was awarded as a sole-source acquisition pursuant to 10 U.S. Code 3204(c)(1) and was previously synopsized on the System for Award Management (SAM.gov) online portal. Strategic Systems Programs, Washington, D.C., is the contracting activity.",
    "parsingConfidence": 1,
    "contractTypes": [
      "cost-plus-fixed-fee"
    ],
    "isIDIQ": false,
    "isMultipleAward": false,
    "isHybridContract": false,
    "isCompeted": false,
    "competitionType": "sole source",
    "isSmallBusinessSetAside": false,
    "isModification": false,
    "isOptionExercise": false
  },
  {
    "article_title": "Contracts For Dec. 1, 2025",
    "article_date": "2025-12-01",
    "article_url": "https://www.war.gov/News/Contracts/Contract/Article/4345564/",
    "vendorName": "Tri-State Government Services Inc.",
    "vendorLocation": "Chattanooga, Tennessee",
    "vendorCity": "Chattanooga",
    "vendorState": "Tennessee",
    "awardAmount": 20861015,
    "awardAmountText": "$20,861,015",
    "contractDescription": "Tri-State Government Services Inc., Chattanooga, Tennessee, has been awarded a maximum $20,861,015 firm-fixed-price, indefinite-delivery/indefinite-quantity contract for hazardous waste removal, transportation and disposal services. This was a competitive acquisition with three responses received. This is a two-year six-month base contract with one two-year six-month option period. Location of performance is Alabama, with a June 1, 2028, ordering period end date. Using customers are Army, Air Force, Army National Guard, and Air National Guard. Type of appropriation is fiscal 2026 through 2027 defense working capital funds. The contracting activity is Defense Logistics Agency Disposition Services, Battle Creek, Michigan (SP4500-26-D-0003).",
    "contractingActivity": "Defense Logistics Agency Disposition Services, Battle Creek, Michigan (SP4500-26-D-0003)",
    "serviceBranch": "DEFENSE LOGISTICS AGENCY",
    "isSmallBusiness": false,
    "rawParagraph": "Tri-State Government Services Inc., Chattanooga, Tennessee, has been awarded a maximum $20,861,015 firm-fixed-price, indefinite-delivery/indefinite-quantity contract for hazardous waste removal, transportation and disposal services. This was a competitive acquisition with three responses received. This is a two-year six-month base contract with one two-year six-month option period. Location of performance is Alabama, with a June 1, 2028, ordering period end date. Using customers are Army, Air Force, Army National Guard, and Air National Guard. Type of appropriation is fiscal 2026 through 2027 defense working capital funds. The contracting activity is Defense Logistics Agency Disposition Services, Battle Creek, Michigan (SP4500-26-D-0003).",
    "parsingConfidence": 0.9500000000000001,
    "contractTypes": [
      "firm-fixed-price",
      "IDIQ"
    ],
    "isIDIQ": true,
    "isMultipleAward": false,
    "isHybridContract": false,
    "isCompeted": null,
    "isSmallBusinessSetAside": false,
    "isModification": false,
    "isOptionExercise": false
  },
  {
    "article_title": "Contracts For Dec. 1, 2025",
    "article_date": "2025-12-01",
    "article_url": "https://www.war.gov/News/Contracts/Contract/Article/4345564/",
    "vendorName": "Lion Vallen Industries",
    "vendorLocation": "Pendergrass, Georgia",
    "vendorCity": "Pendergrass",
    "vendorState": "Georgia",
    "awardAmount": 10117070,
    "awardAmountText": "$10,117,070",
    "contractDescription": "Lion Vallen Industries,* Pendergrass, Georgia, has been awarded an estimated $10,117,070 modification (P00022) exercising the fourth one‐year option period of a two‐year base contract (SPE1C1‐21‐D‐1417) with five one‐year option periods for warehousing, storage, logistics and distribution functions. This is a firm-fixed‐price with economic‐price‐adjustment, indefinite-delivery/indefinite-quantity contract. The ordering period end date is Dec. 1, 2026. Using military services are Army, Navy, Air Force, and Marine Corps. Type of appropriation is fiscal 2026 through 2027 defense working capital funds. The contracting activity is Defense Logistics Agency Troop Support, Philadelphia, Pennsylvania.",
    "contractingActivity": "Defense Logistics Agency Troop Support, Philadelphia, Pennsylvania",
    "serviceBranch": "DEFENSE LOGISTICS AGENCY",
    "isSmallBusiness": false,
    "rawParagraph": "Lion Vallen Industries,* Pendergrass, Georgia, has been awarded an estimated $10,117,070 modification (P00022) exercising the fourth one‐year option period of a two‐year base contract (SPE1C1‐21‐D‐1417) with five one‐year option periods for warehousing, storage, logistics and distribution functions. This is a firm-fixed‐price with economic‐price‐adjustment, indefinite-delivery/indefinite-quantity contract. The ordering period end date is Dec. 1, 2026. Using military services are Army, Navy, Air Force, and Marine Corps. Type of appropriation is fiscal 2026 through 2027 defense working capital funds. The contracting activity is Defense Logistics Agency Troop Support, Philadelphia, Pennsylvania.",
    "parsingConfidence": 0.9500000000000001,
    "contractTypes": [
      "IDIQ"
    ],
    "isIDIQ": true,
    "isMultipleAward": false,
    "isHybridContract": false,
    "isCompeted": null,
    "isSmallBusinessSetAside": false,
    "isModification": false,
    "isOptionExercise": false
  },
  {
    "article_title": "Contracts For Nov. 28, 2025",
    "article_date": "2025-11-28",
    "article_url": "https://www.war.gov/News/Contracts/Contract/Article/4344447/",
    "vendorName": "RTX Corp.",
    "vendorLocation": "East Hartford, Connecticut",
    "vendorCity": "East Hartford",
    "vendorState": "Connecticut",
    "contractNumber": "N0001926C0112",
    "awardAmount": 1606190091,
    "awardAmountText": "$1,606,190,091",
    "contractDescription": "RTX Corp., Pratt & Whitney Military Engines, East Hartford, Connecticut, is awarded a not-to-exceed $1,606,190,091 cost, cost-plus-fixed-fee, cost-plus-incentive-fee, and fixed-price-incentive-fee undefinitized contract for recurring sustainment support, program management, financial and administrative activities, propulsion integration, replenishment spare part buys, engineering support, material management, configuration management, product management support, software sustainment, security management, Joint Technical Data updates, support equipment management, depot level maintenance and repair for all fielded propulsion systems at the F-35 production sites and operational locations, as well as training for propulsion systems used in F-35 air vehicle. It provides global maintenance services for F135 propulsion system at unit and depot levels, as well as replenishment spare parts. Work will be performed in East Hartford, Connecticut (40%); Oklahoma City, Oklahoma (21%); Indianapolis, Indiana (12%); West Palm Beach, Florida (6%); Windsor Locks, Connecticut (6%); Brekstad, Norway (4%); Leeuwarden, Netherlands (3%); Iwakuni, Japan (3%); Williamstown, Australia (2%); Cameri, Italy (1%); Marham, United Kingdom (1%); and Fort Worth, Texas (1%), and expected to be completed in November 2026. Fiscal 2026 operations and maintenance funds (Air Force) in the amount of $56,480,819; fiscal 2026 operations and maintenance funds (Marine Corps) in the amount of $30,665,093; fiscal 2026 operations and maintenance funds (Navy) in the amount of $11,829,825; and partner and Foreign Military Sales funding in the amount of $51,017,310, will be obligated at the time of award, $98,975,737 of which expire at the end of the current fiscal year. This contract was not competed. Naval Air Systems Command, Patuxent River, Maryland, is the contracting activity (N0001926C0112). (Awarded Nov. 26, 2025)",
    "serviceBranch": "NAVY",
    "isSmallBusiness": false,
    "rawParagraph": "RTX Corp., Pratt & Whitney Military Engines, East Hartford, Connecticut, is awarded a not-to-exceed $1,606,190,091 cost, cost-plus-fixed-fee, cost-plus-incentive-fee, and fixed-price-incentive-fee undefinitized contract for recurring sustainment support, program management, financial and administrative activities, propulsion integration, replenishment spare part buys, engineering support, material management, configuration management, product management support, software sustainment, security management, Joint Technical Data updates, support equipment management, depot level maintenance and repair for all fielded propulsion systems at the F-35 production sites and operational locations, as well as training for propulsion systems used in F-35 air vehicle. It provides global maintenance services for F135 propulsion system at unit and depot levels, as well as replenishment spare parts. Work will be performed in East Hartford, Connecticut (40%); Oklahoma City, Oklahoma (21%); Indianapolis, Indiana (12%); West Palm Beach, Florida (6%); Windsor Locks, Connecticut (6%); Brekstad, Norway (4%); Leeuwarden, Netherlands (3%); Iwakuni, Japan (3%); Williamstown, Australia (2%); Cameri, Italy (1%); Marham, United Kingdom (1%); and Fort Worth, Texas (1%), and expected to be completed in November 2026. Fiscal 2026 operations and maintenance funds (Air Force) in the amount of $56,480,819; fiscal 2026 operations and maintenance funds (Marine Corps) in the amount of $30,665,093; fiscal 2026 operations and maintenance funds (Navy) in the amount of $11,829,825; and partner and Foreign Military Sales funding in the amount of $51,017,310, will be obligated at the time of award, $98,975,737 of which expire at the end of the current fiscal year. This contract was not competed. Naval Air Systems Command, Patuxent River, Maryland, is the contracting activity (N0001926C0112). (Awarded Nov. 26, 2025)",
    "parsingConfidence": 1,
    "contractTypes": [
      "cost-plus-fixed-fee",
      "cost-plus-incentive-fee",
      "fixed-price-incentive-fee"
    ],
    "isIDIQ": false,
    "isMultipleAward": false,
    "isHybridContract": true,
    "isCompeted": false,
    "competitionType": "sole source",
    "isSmallBusinessSetAside": false,
    "isModification": false,
    "isOptionExercise": false
  },
  {
    "article_title": "Contracts For Nov. 28, 2025",
    "article_date": "2025-11-28",
    "article_url": "https://www.war.gov/News/Contracts/Contract/Article/4344447/",
    "vendorName": "Lockheed Martin Corp.",
    "vendorLocation": "Orlando, Florida",
    "vendorCity": "Orlando",
    "vendorState": "Florida",
    "contractNumber": "N6833524D0010",
    "awardAmount": 264991123,
    "awardAmountText": "$264,991,123",
    "contractDescription": "Lockheed Martin Corp., Orlando, Florida, was awarded a $264,991,123 firm-fixed-price, cost-plus-fixed-fee modification (P00007) to a previously awarded not-to-exceed, undefinitized, indefinite-delivery/indefinite-quantity contract (N6833524D0010). This modification extends the period of performance to continue to provide performance-based logistics for the Consolidated Automated Support System family of testers supporting naval aviation systems at the intermediate maintenance level, both ashore and afloat, in addition to naval aviation repair depots and international program's repair sites in support of Foreign Military Sales customers. Work locations will be determined with each individual delivery order. Work is expected to be completed March 2031. No funds will be obligated at the time of award; funds will be obligated on individual orders as they are issued. This contract was competed. Naval Air Warfare Center Aircraft Division, Lakehurst, New Jersey, is the contracting activity. (Awarded Nov. 25, 2025)",
    "completionDate": "2031-03-01T05:00:00.000Z",
    "serviceBranch": "NAVY",
    "isSmallBusiness": false,
    "rawParagraph": "Lockheed Martin Corp., Orlando, Florida, was awarded a $264,991,123 firm-fixed-price, cost-plus-fixed-fee modification (P00007) to a previously awarded not-to-exceed, undefinitized, indefinite-delivery/indefinite-quantity contract (N6833524D0010). This modification extends the period of performance to continue to provide performance-based logistics for the Consolidated Automated Support System family of testers supporting naval aviation systems at the intermediate maintenance level, both ashore and afloat, in addition to naval aviation repair depots and international program's repair sites in support of Foreign Military Sales customers. Work locations will be determined with each individual delivery order. Work is expected to be completed March 2031. No funds will be obligated at the time of award; funds will be obligated on individual orders as they are issued. This contract was competed. Naval Air Warfare Center Aircraft Division, Lakehurst, New Jersey, is the contracting activity. (Awarded Nov. 25, 2025)",
    "parsingConfidence": 1,
    "contractTypes": [
      "firm-fixed-price",
      "cost-plus-fixed-fee",
      "IDIQ"
    ],
    "isIDIQ": true,
    "isMultipleAward": false,
    "isHybridContract": true,
    "isCompeted": null,
    "isSmallBusinessSetAside": false,
    "isModification": false,
    "isOptionExercise": false
  },
  {
    "article_title": "Contracts For Nov. 28, 2025",
    "article_date": "2025-11-28",
    "article_url": "https://www.war.gov/News/Contracts/Contract/Article/4344447/",
    "vendorName": "Lockheed Martin Corp.",
    "vendorLocation": "Fort Worth, Texas",
    "vendorCity": "Fort Worth",
    "vendorState": "Texas",
    "contractNumber": "N0001925C0070",
    "awardAmount": 178360242,
    "awardAmountText": "$178,360,242",
    "contractDescription": "Lockheed Martin Corp., Lockheed Martin Aeronautics Co., Fort Worth, Texas, is awarded a $178,360,242 modification (P00004) to a previously awarded, fixed-price incentive (firm-target) undefinitized, advanced acquisition contract (N0001925C0070). This modification adds scope to procure economic order quantity material, parts, and components for four Lot 20 aircraft, 22 Lot 21 aircraft and 22 Lot 22 aircraft for F-35 cooperative program partners and Foreign Military Sales (FMS) customers. Work will be performed in Fort Worth, Texas (59%); El Segundo, California (14%); Warton, United Kingdom (9%); Cameri, Italy (4%); Orlando, Florida (4%); Nashua, New Hampshire (3%); Baltimore, Maryland (3%); San Diego, California (2%); and various locations outside the continental U.S. (2%), and is expected to be completed in December 2030. FMS customer funds in the amount of $36,360,242; and cooperative program partner funds in the amount of $142,000,000, will be obligated at the time of award, none of which expire at the end of the current fiscal year. This contract was not competed. Naval Air Systems Command, Patuxent River, Maryland, is the contracting activity. (Awarded Nov. 26, 2025)",
    "serviceBranch": "NAVY",
    "isSmallBusiness": false,
    "rawParagraph": "Lockheed Martin Corp., Lockheed Martin Aeronautics Co., Fort Worth, Texas, is awarded a $178,360,242 modification (P00004) to a previously awarded, fixed-price incentive (firm-target) undefinitized, advanced acquisition contract (N0001925C0070). This modification adds scope to procure economic order quantity material, parts, and components for four Lot 20 aircraft, 22 Lot 21 aircraft and 22 Lot 22 aircraft for F-35 cooperative program partners and Foreign Military Sales (FMS) customers. Work will be performed in Fort Worth, Texas (59%); El Segundo, California (14%); Warton, United Kingdom (9%); Cameri, Italy (4%); Orlando, Florida (4%); Nashua, New Hampshire (3%); Baltimore, Maryland (3%); San Diego, California (2%); and various locations outside the continental U.S. (2%), and is expected to be completed in December 2030. FMS customer funds in the amount of $36,360,242; and cooperative program partner funds in the amount of $142,000,000, will be obligated at the time of award, none of which expire at the end of the current fiscal year. This contract was not competed. Naval Air Systems Command, Patuxent River, Maryland, is the contracting activity. (Awarded Nov. 26, 2025)",
    "parsingConfidence": 0.95,
    "isIDIQ": false,
    "isMultipleAward": false,
    "isHybridContract": false,
    "isCompeted": false,
    "competitionType": "sole source",
    "isSmallBusinessSetAside": false,
    "isModification": false,
    "isOptionExercise": false
  },
  {
    "article_title": "Contracts For Nov. 28, 2025",
    "article_date": "2025-11-28",
    "article_url": "https://www.war.gov/News/Contracts/Contract/Article/4344447/",
    "vendorName": "Crowley Government Services Inc.",
    "vendorLocation": "Jacksonville, Florida",
    "vendorCity": "Jacksonville",
    "vendorState": "Florida",
    "contractNumber": "N3220526C0001",
    "awardAmount": 62398506,
    "awardAmountText": "$62,398,506",
    "contractDescription": "Crowley Government Services Inc., Jacksonville, Florida, is being awarded a $62,398,506 firm,-fixed-price contract (N3220526C0001) for the operation and maintenance of six government-owned Transportation Auxiliary General Ocean Surveillance (T-AGOS) and Transportation Auxiliary General Missile Range instrument (T-AGM) vessels. The vessels under this award include United States Naval Ship (USNS) Victorious (T-AGOS 19), USNS Able (T-AGOS 20), USNS Effective (T-AGOS 21), USNS Loyal (T-AGOS 22), USNS Impeccable (T-AGOS 23), and USNS Howard O. Lorenzen (T-AGM 25). The contract will be performed on a worldwide basis beginning Dec. 1, 2025, and will conclude on Nov. 30, 2026, if all options are exercised. This contract was a sole-source bridge with a proposal being received from the sole offeror under the authority of 10 U.S. Code. 3204(a)(1), as implemented by Federal Acquisition Regulation 6.302-1 Only One Responsible Source and No Other Supplies or Services Will Satisfy Agency Requirements. Military Sealift Command, Norfolk, Virginia, is the contracting activity. (Awarded Nov. 26, 2025)",
    "serviceBranch": "NAVY",
    "isSmallBusiness": false,
    "rawParagraph": "Crowley Government Services Inc., Jacksonville, Florida, is being awarded a $62,398,506 firm,-fixed-price contract (N3220526C0001) for the operation and maintenance of six government-owned Transportation Auxiliary General Ocean Surveillance (T-AGOS) and Transportation Auxiliary General Missile Range instrument (T-AGM) vessels. The vessels under this award include United States Naval Ship (USNS) Victorious (T-AGOS 19), USNS Able (T-AGOS 20), USNS Effective (T-AGOS 21), USNS Loyal (T-AGOS 22), USNS Impeccable (T-AGOS 23), and USNS Howard O. Lorenzen (T-AGM 25). The contract will be performed on a worldwide basis beginning Dec. 1, 2025, and will conclude on Nov. 30, 2026, if all options are exercised. This contract was a sole-source bridge with a proposal being received from the sole offeror under the authority of 10 U.S. Code. 3204(a)(1), as implemented by Federal Acquisition Regulation 6.302-1 Only One Responsible Source and No Other Supplies or Services Will Satisfy Agency Requirements. Military Sealift Command, Norfolk, Virginia, is the contracting activity. (Awarded Nov. 26, 2025)",
    "parsingConfidence": 0.95,
    "isIDIQ": false,
    "isMultipleAward": false,
    "isHybridContract": false,
    "isCompeted": false,
    "competitionType": "sole source",
    "nonCompeteAuthority": "10 U",
    "isSmallBusinessSetAside": false,
    "isModification": false,
    "isOptionExercise": false
  },
  {
    "article_title": "Contracts For Nov. 28, 2025",
    "article_date": "2025-11-28",
    "article_url": "https://www.war.gov/News/Contracts/Contract/Article/4344447/",
    "vendorName": "Kellogg Brown & Root Services Inc.",
    "vendorLocation": "Houston, Texas",
    "vendorCity": "Houston",
    "vendorState": "Texas",
    "contractNumber": "N62470-17-D-4007",
    "awardAmount": 30236090,
    "awardAmountText": "$30,236,090",
    "contractDescription": "Kellogg Brown & Root Services Inc., Houston, Texas, is awarded a $30,236,090 firm-fixed-price, indefinite-delivery/indefinite-quantity modification to previously awarded contract (N62470-17-D-4007). This award brings the total cumulative value to $228,461,245. This modification provides a bridge to the terms of the contract for base operating support services at Naval Support Activity Bahrain. Work will be performed in Bahrain and is expected to be completed by December 2026. No funds will be obligated at time of award. Fiscal 2026 operation and maintenance (Navy) funds will be obligated on individual task orders, subject to the availability of funds. The Naval Facilities Engineering Systems Command, Europe, Africa, Central, is the contracting activity. (Awarded Nov. 26, 2025)",
    "completionDate": "2026-12-01T05:00:00.000Z",
    "serviceBranch": "NAVY",
    "isSmallBusiness": false,
    "rawParagraph": "Kellogg Brown & Root Services Inc., Houston, Texas, is awarded a $30,236,090 firm-fixed-price, indefinite-delivery/indefinite-quantity modification to previously awarded contract (N62470-17-D-4007). This award brings the total cumulative value to $228,461,245. This modification provides a bridge to the terms of the contract for base operating support services at Naval Support Activity Bahrain. Work will be performed in Bahrain and is expected to be completed by December 2026. No funds will be obligated at time of award. Fiscal 2026 operation and maintenance (Navy) funds will be obligated on individual task orders, subject to the availability of funds. The Naval Facilities Engineering Systems Command, Europe, Africa, Central, is the contracting activity. (Awarded Nov. 26, 2025)",
    "parsingConfidence": 1,
    "contractTypes": [
      "firm-fixed-price",
      "IDIQ"
    ],
    "isIDIQ": true,
    "isMultipleAward": false,
    "isHybridContract": false,
    "isCompeted": null,
    "isSmallBusinessSetAside": false,
    "isModification": true,
    "baseContractNumber": "N62470-17-D-4007",
    "isOptionExercise": false,
    "modificationType": "other modification"
  },
  {
    "article_title": "Contracts For Nov. 28, 2025",
    "article_date": "2025-11-28",
    "article_url": "https://www.war.gov/News/Contracts/Contract/Article/4344447/",
    "vendorName": "BAE Systems Jacksonville Ship Repair LLC",
    "vendorLocation": "Jacksonville, Florida",
    "vendorCity": "Jacksonville",
    "vendorState": "Florida",
    "contractNumber": "N00024-20-C-2320",
    "awardAmount": 26447362,
    "awardAmountText": "$26,447,362",
    "contractDescription": "BAE Systems Jacksonville Ship Repair LLC, Jacksonville, Florida, is awarded a $26,447,362 cost-plus-award-fee modification to a previously awarded contract (N00024-20-C-2320) for the accomplishment of a Post Shakedown Availability for a Littoral Combat Ship. Work will be performed in Mayport, Florida, and is expected to be completed by August 2027. Fiscal 2019 shipbuilding and conversion (Navy) funds in the amount of $468,234 will be obligated at time of award and will not expire at the end of the current fiscal year. Naval Sea Systems Command, Washington, D.C., is the contracting activity. (Awarded Nov. 26, 2025)",
    "completionDate": "2027-08-01T04:00:00.000Z",
    "serviceBranch": "NAVAL SEA SYSTEMS COMMAND",
    "isSmallBusiness": false,
    "rawParagraph": "BAE Systems Jacksonville Ship Repair LLC, Jacksonville, Florida, is awarded a $26,447,362 cost-plus-award-fee modification to a previously awarded contract (N00024-20-C-2320) for the accomplishment of a Post Shakedown Availability for a Littoral Combat Ship. Work will be performed in Mayport, Florida, and is expected to be completed by August 2027. Fiscal 2019 shipbuilding and conversion (Navy) funds in the amount of $468,234 will be obligated at time of award and will not expire at the end of the current fiscal year. Naval Sea Systems Command, Washington, D.C., is the contracting activity. (Awarded Nov. 26, 2025)",
    "parsingConfidence": 0.95,
    "isIDIQ": false,
    "isMultipleAward": false,
    "isHybridContract": false,
    "isCompeted": null,
    "isSmallBusinessSetAside": false,
    "isModification": false,
    "isOptionExercise": false
  },
  {
    "article_title": "Contracts For Nov. 28, 2025",
    "article_date": "2025-11-28",
    "article_url": "https://www.war.gov/News/Contracts/Contract/Article/4344447/",
    "vendorName": "BAE Systems Land & Armaments L.P",
    "vendorLocation": "Minneapolis, Minnesota",
    "vendorCity": "Minneapolis",
    "vendorState": "Minnesota",
    "contractNumber": "N00024-25-C-5315",
    "awardAmount": 23298840,
    "awardAmountText": "$23,298,840",
    "contractDescription": "BAE Systems Land & Armaments L.P, Minneapolis, Minnesota, was awarded a $23,298,840 firm-fixed-price modification to a previously awarded contract (N00024-25-C-5315) for MK 41 Vertical Launching System canister and ancillary equipment production. This action combines purchases for the Navy (48%); and the government of Japan (52%), under the Foreign Military Sales (FMS) program. Work will be performed in Aberdeen, South Dakota (90%); and Minneapolis, Minnesota (10%), and is expected to be completed by February 2028. FMS (Japan) funds in the amount of $12,080,880 (52%); and fiscal 2025 Defense-wide procurement funds in the amount of $11,217,960 (48%), will be obligated at time of award and will not expire at the end of the current fiscal year. Naval Sea Systems Command, Washington, D.C., is the contracting activity. (Awarded Nov. 24, 2025)",
    "completionDate": "2028-02-01T05:00:00.000Z",
    "serviceBranch": "NAVAL SEA SYSTEMS COMMAND",
    "isSmallBusiness": false,
    "rawParagraph": "BAE Systems Land & Armaments L.P, Minneapolis, Minnesota, was awarded a $23,298,840 firm-fixed-price modification to a previously awarded contract (N00024-25-C-5315) for MK 41 Vertical Launching System canister and ancillary equipment production. This action combines purchases for the Navy (48%); and the government of Japan (52%), under the Foreign Military Sales (FMS) program. Work will be performed in Aberdeen, South Dakota (90%); and Minneapolis, Minnesota (10%), and is expected to be completed by February 2028. FMS (Japan) funds in the amount of $12,080,880 (52%); and fiscal 2025 Defense-wide procurement funds in the amount of $11,217,960 (48%), will be obligated at time of award and will not expire at the end of the current fiscal year. Naval Sea Systems Command, Washington, D.C., is the contracting activity. (Awarded Nov. 24, 2025)",
    "parsingConfidence": 1,
    "contractTypes": [
      "firm-fixed-price"
    ],
    "isIDIQ": false,
    "isMultipleAward": false,
    "isHybridContract": false,
    "isCompeted": null,
    "isSmallBusinessSetAside": false,
    "isModification": false,
    "isOptionExercise": false
  },
  {
    "article_title": "Contracts For Nov. 28, 2025",
    "article_date": "2025-11-28",
    "article_url": "https://www.war.gov/News/Contracts/Contract/Article/4344447/",
    "vendorName": "Proferre Inc.",
    "vendorLocation": "Tumon, Guam",
    "vendorCity": "Tumon",
    "vendorState": "Guam",
    "contractNumber": "N40192-25-D-9000",
    "awardAmount": 9716651,
    "awardAmountText": "$9,716,651",
    "contractDescription": "Proferre Inc.,* Tumon, Guam, is awarded a $9,716,651 firm-fixed-price, indefinite-delivery/indefinite-quantity modification to a previously awarded contract (N40192-25-D-9000) for grounds maintenance and tree trimming services. This award brings the total cumulative face value of the contract to $19,139,369. The contract modification is for the exercise of the first option period. Work will be performed at Naval Base Guam, and Andersen Air Force Base, Guam, and is expected to be completed by November 2029. No funds will be obligated at time of award. The Naval Facilities Engineering Systems Command, Marianas, Guam, is the contracting activity. (Awarded Nov. 26, 2025)",
    "completionDate": "2029-11-01T04:00:00.000Z",
    "serviceBranch": "AIR FORCE",
    "isSmallBusiness": false,
    "rawParagraph": "Proferre Inc.,* Tumon, Guam, is awarded a $9,716,651 firm-fixed-price, indefinite-delivery/indefinite-quantity modification to a previously awarded contract (N40192-25-D-9000) for grounds maintenance and tree trimming services. This award brings the total cumulative face value of the contract to $19,139,369. The contract modification is for the exercise of the first option period. Work will be performed at Naval Base Guam, and Andersen Air Force Base, Guam, and is expected to be completed by November 2029. No funds will be obligated at time of award. The Naval Facilities Engineering Systems Command, Marianas, Guam, is the contracting activity. (Awarded Nov. 26, 2025)",
    "parsingConfidence": 1,
    "contractTypes": [
      "firm-fixed-price",
      "IDIQ"
    ],
    "isIDIQ": true,
    "isMultipleAward": false,
    "isHybridContract": false,
    "isCompeted": null,
    "isSmallBusinessSetAside": false,
    "isModification": true,
    "baseContractNumber": "N40192-25-D-9000",
    "isOptionExercise": false,
    "modificationType": "other modification"
  },
  {
    "article_title": "Contracts For Nov. 28, 2025",
    "article_date": "2025-11-28",
    "article_url": "https://www.war.gov/News/Contracts/Contract/Article/4344447/",
    "vendorName": "Cummins Power Generation Inc.",
    "vendorLocation": "Minneapolis, Minnesota",
    "vendorCity": "Minneapolis",
    "vendorState": "Minnesota",
    "awardAmount": 500000000,
    "awardAmountText": "$500,000,000",
    "contractDescription": "Cummins Power Generation Inc., Minneapolis, Minnesota, was awarded a $500,000,000 firm-fixed-price contract for the production and minor modification of 500-kilowatt skid mobile electric power generator sets and power plants in support of Foreign Military Sales to Poland. Work locations and funding will be determined with each order, with an estimated completion date of Nov. 26, 2025. Army Contracting Command, Aberdeen Proving Ground, Maryland, is the contracting activity (W909MY-26-D-0001). (Awarded Nov. 26, 2025)",
    "serviceBranch": "ARMY",
    "isSmallBusiness": false,
    "rawParagraph": "Cummins Power Generation Inc., Minneapolis, Minnesota, was awarded a $500,000,000 firm-fixed-price contract for the production and minor modification of 500-kilowatt skid mobile electric power generator sets and power plants in support of Foreign Military Sales to Poland. Work locations and funding will be determined with each order, with an estimated completion date of Nov. 26, 2025. Army Contracting Command, Aberdeen Proving Ground, Maryland, is the contracting activity (W909MY-26-D-0001). (Awarded Nov. 26, 2025)",
    "parsingConfidence": 0.9,
    "contractTypes": [
      "firm-fixed-price"
    ],
    "isIDIQ": false,
    "isMultipleAward": false,
    "isHybridContract": false,
    "isCompeted": null,
    "isSmallBusinessSetAside": false,
    "isModification": false,
    "isOptionExercise": false
  },
  {
    "article_title": "Contracts For Nov. 28, 2025",
    "article_date": "2025-11-28",
    "article_url": "https://www.war.gov/News/Contracts/Contract/Article/4344447/",
    "vendorName": "TREVIICOS South Inc.",
    "vendorLocation": "Charlestown, Massachusetts",
    "vendorCity": "Charlestown",
    "vendorState": "Massachusetts",
    "contractNumber": "W91237-26-C-0001",
    "awardAmount": 42452518,
    "awardAmountText": "$42,452,518",
    "contractDescription": "TREVIICOS South Inc., Charlestown, Massachusetts, was awarded a $42,452,518 firm-fixed-price contract for the re-procurement following termination and litigation of the Portsmouth Levee Seepage Barrier Remediation Project in Portsmouth, Ohio. Work will be performed in Portsmouth, Ohio, with an estimated completion date of Dec. 31, 2027. Fiscal 2018 operation and maintenance, Recovery Act, Corps of Engineers – Civil funds in the amount of $42,452,518 were obligated at the time of the award. U.S. Army Corps of Engineers, Huntington District, is the contracting activity (W91237-26-C-0001). (Awarded Nov. 26, 2025)",
    "serviceBranch": "ARMY",
    "isSmallBusiness": false,
    "rawParagraph": "TREVIICOS South Inc., Charlestown, Massachusetts, was awarded a $42,452,518 firm-fixed-price contract for the re-procurement following termination and litigation of the Portsmouth Levee Seepage Barrier Remediation Project in Portsmouth, Ohio. Work will be performed in Portsmouth, Ohio, with an estimated completion date of Dec. 31, 2027. Fiscal 2018 operation and maintenance, Recovery Act, Corps of Engineers – Civil funds in the amount of $42,452,518 were obligated at the time of the award. U.S. Army Corps of Engineers, Huntington District, is the contracting activity (W91237-26-C-0001). (Awarded Nov. 26, 2025)",
    "parsingConfidence": 1,
    "contractTypes": [
      "firm-fixed-price"
    ],
    "isIDIQ": false,
    "isMultipleAward": false,
    "isHybridContract": false,
    "isCompeted": null,
    "isSmallBusinessSetAside": false,
    "isModification": false,
    "isOptionExercise": false
  },
  {
    "article_title": "Contracts For Nov. 28, 2025",
    "article_date": "2025-11-28",
    "article_url": "https://www.war.gov/News/Contracts/Contract/Article/4344447/",
    "vendorName": "Donald Bond Construction Inc.",
    "vendorLocation": "Benton, Missouri",
    "vendorCity": "Benton",
    "vendorState": "Missouri",
    "awardAmount": 99500000,
    "awardAmountText": "$99,500,000",
    "contractDescription": "Donald Bond Construction Inc.,* Benton, Missouri (W912EQ-26-D-A006); Coastal Environmental Group Inc.,* Omaha, Nebraska (W912EQ-26-D-A007); Graylee Construction LLC,* Beebe, Arkansas (W912EQ-26-D-A008); Bloomsdale Excavating Company Inc.,* Bloomsdale, Missouri (W912EQ-26-D-A009); and Dumey Contracting Inc.,* Benton, Missouri (W912EQ-26-D-A010), will compete for each order of the $99,500,000 firm-fixed-price contract for miscellaneous civil works projects within the boundaries of the Memphis District, including preconstruction services, design-build horizontal construction, new construction, repairs, and alterations such as gravel resurfacing, channel cleanout, scour repair, floodwall and floodgate repairs, and pump station rehabilitation. Work locations and funding will be determined with each order, with an estimated completion date of Nov. 25, 2030. U.S. Army Corps of Engineers, Memphis District, is the contracting activity. (Awarded Nov. 26, 2025)",
    "serviceBranch": "ARMY",
    "isSmallBusiness": false,
    "rawParagraph": "Donald Bond Construction Inc.,* Benton, Missouri (W912EQ-26-D-A006); Coastal Environmental Group Inc.,* Omaha, Nebraska (W912EQ-26-D-A007); Graylee Construction LLC,* Beebe, Arkansas (W912EQ-26-D-A008); Bloomsdale Excavating Company Inc.,* Bloomsdale, Missouri (W912EQ-26-D-A009); and Dumey Contracting Inc.,* Benton, Missouri (W912EQ-26-D-A010), will compete for each order of the $99,500,000 firm-fixed-price contract for miscellaneous civil works projects within the boundaries of the Memphis District, including preconstruction services, design-build horizontal construction, new construction, repairs, and alterations such as gravel resurfacing, channel cleanout, scour repair, floodwall and floodgate repairs, and pump station rehabilitation. Work locations and funding will be determined with each order, with an estimated completion date of Nov. 25, 2030. U.S. Army Corps of Engineers, Memphis District, is the contracting activity. (Awarded Nov. 26, 2025)",
    "parsingConfidence": 0.9,
    "contractTypes": [
      "firm-fixed-price"
    ],
    "isIDIQ": false,
    "isMultipleAward": false,
    "isHybridContract": false,
    "isCompeted": null,
    "isSmallBusinessSetAside": false,
    "isModification": false,
    "isOptionExercise": false
  },
  {
    "article_title": "Contracts For Nov. 28, 2025",
    "article_date": "2025-11-28",
    "article_url": "https://www.war.gov/News/Contracts/Contract/Article/4344447/",
    "vendorName": "New South Associates Inc.",
    "vendorLocation": "Stone Mountain, Georgia",
    "vendorCity": "Stone Mountain",
    "vendorState": "Georgia",
    "awardAmount": 40000000,
    "awardAmountText": "$40,000,000",
    "contractDescription": "New South Associates Inc.,* Stone Mountain, Georgia (W912P9-26-D-A015); Stell Environmental Enterprises Inc.,* Exton, Pennsylvania (W912P9-26-D-A016); and ERG-Terracon JV2 LLC,* Baltimore, Maryland (W912P9-26-D-A017), will compete for each order of the $40,000,000 firm-fixed-price contract to provide multidisciplinary cultural resource-related services for projects undertaken by the St. Louis District, including terrestrial and marine archaeological investigations, historic preservation, architectural history, archival and knowledge management, Native American Graves Protection and Repatriation Act summary and inventory, GIS and GPS services, object and collection moves, and ethnographic and historic studies. Work locations and funding will be determined with each order, with an estimated completion date of Nov. 25, 2030. U.S. Army Corps of Engineers, St. Louis District, is the contracting activity. (Awarded Nov. 26, 2025)",
    "serviceBranch": "ARMY",
    "isSmallBusiness": false,
    "rawParagraph": "New South Associates Inc.,* Stone Mountain, Georgia (W912P9-26-D-A015); Stell Environmental Enterprises Inc.,* Exton, Pennsylvania (W912P9-26-D-A016); and ERG-Terracon JV2 LLC,* Baltimore, Maryland (W912P9-26-D-A017), will compete for each order of the $40,000,000 firm-fixed-price contract to provide multidisciplinary cultural resource-related services for projects undertaken by the St. Louis District, including terrestrial and marine archaeological investigations, historic preservation, architectural history, archival and knowledge management, Native American Graves Protection and Repatriation Act summary and inventory, GIS and GPS services, object and collection moves, and ethnographic and historic studies. Work locations and funding will be determined with each order, with an estimated completion date of Nov. 25, 2030. U.S. Army Corps of Engineers, St. Louis District, is the contracting activity. (Awarded Nov. 26, 2025)",
    "parsingConfidence": 0.9,
    "contractTypes": [
      "firm-fixed-price"
    ],
    "isIDIQ": false,
    "isMultipleAward": false,
    "isHybridContract": false,
    "isCompeted": null,
    "isSmallBusinessSetAside": false,
    "isModification": false,
    "isOptionExercise": false
  },
  {
    "article_title": "Contracts For Nov. 28, 2025",
    "article_date": "2025-11-28",
    "article_url": "https://www.war.gov/News/Contracts/Contract/Article/4344447/",
    "vendorName": "M1 Support Services LP",
    "vendorLocation": "Denton, Texas",
    "vendorCity": "Denton",
    "vendorState": "Texas",
    "awardAmount": 115421582,
    "awardAmountText": "$115,421,582",
    "contractDescription": "M1 Support Services LP, Denton, Texas, was awarded a $115,421,582 fixed-price-incentive-fee task order with cost-reimbursable line items for the T-38 aircraft maintenance program operations and maintenance services and sustainment. The contract provides for B-2 and U-2 pilots with a companion training capability and adversary air assets for the F-22 community. Work will be performed at Beale Air Force Base, California; Holloman AFB, New Mexico; Langley AFB, Virginia; Tyndall AFB, Florida; and Whiteman AFB, Missouri, and is expected to be completed by Jan. 31, 2030. This contract was a competitive acquisition and three proposals were received.  Fiscal 2026 operations and maintenance funds in the amount of $115,421,582 are being obligated at the time of award. The Headquarters Acquisition Management Integration Center, Hampton, Virginia, is the contracting activity (FA489026F0002). (Awarded on Nov. 25, 2025)\n \nNorthrup Grumman Systems Corp., Oklahoma City, Oklahoma, was awarded a $35,057,531 firm-fixed-price contract for B-2 tailpipe ducts and cover assembly repair and overhaul. This contract provides for the repair and overhaul for the B-2 Tailpipes Ducts and Cover Assembly, and all associated supplies. Work will be performed at El Segundo, California; and Oklahoma City, Oklahoma, and is expected to be completed by Nov. 26, 2030. This contract was a sole source acquisition. No funds will be obligated at the time of award. The Air Force Sustainment Center, Tinker Air Force Base, Oklahoma, is the contracting activity (FA8119-26-D-0001). (Awarded Nov. 26, 2025)",
    "serviceBranch": "AIR FORCE",
    "isSmallBusiness": false,
    "rawParagraph": "M1 Support Services LP, Denton, Texas, was awarded a $115,421,582 fixed-price-incentive-fee task order with cost-reimbursable line items for the T-38 aircraft maintenance program operations and maintenance services and sustainment. The contract provides for B-2 and U-2 pilots with a companion training capability and adversary air assets for the F-22 community. Work will be performed at Beale Air Force Base, California; Holloman AFB, New Mexico; Langley AFB, Virginia; Tyndall AFB, Florida; and Whiteman AFB, Missouri, and is expected to be completed by Jan. 31, 2030. This contract was a competitive acquisition and three proposals were received.  Fiscal 2026 operations and maintenance funds in the amount of $115,421,582 are being obligated at the time of award. The Headquarters Acquisition Management Integration Center, Hampton, Virginia, is the contracting activity (FA489026F0002). (Awarded on Nov. 25, 2025)\n \nNorthrup Grumman Systems Corp., Oklahoma City, Oklahoma, was awarded a $35,057,531 firm-fixed-price contract for B-2 tailpipe ducts and cover assembly repair and overhaul. This contract provides for the repair and overhaul for the B-2 Tailpipes Ducts and Cover Assembly, and all associated supplies. Work will be performed at El Segundo, California; and Oklahoma City, Oklahoma, and is expected to be completed by Nov. 26, 2030. This contract was a sole source acquisition. No funds will be obligated at the time of award. The Air Force Sustainment Center, Tinker Air Force Base, Oklahoma, is the contracting activity (FA8119-26-D-0001). (Awarded Nov. 26, 2025)",
    "parsingConfidence": 0.9,
    "contractTypes": [
      "firm-fixed-price",
      "fixed-price-incentive-fee",
      "cost-reimbursable"
    ],
    "isIDIQ": false,
    "isMultipleAward": false,
    "isHybridContract": true,
    "isCompeted": false,
    "competitionType": "sole source",
    "isSmallBusinessSetAside": false,
    "isModification": false,
    "isOptionExercise": false
  },
  {
    "article_title": "Contracts For Nov. 28, 2025",
    "article_date": "2025-11-28",
    "article_url": "https://www.war.gov/News/Contracts/Contract/Article/4344447/",
    "vendorName": "Petroleum Traders Corp.",
    "vendorLocation": "Fort Wayne, Indiana",
    "vendorCity": "Fort Wayne",
    "vendorState": "Indiana",
    "awardAmount": 70134920,
    "awardAmountText": "$70,134,920",
    "contractDescription": "Petroleum Traders Corp.,* Fort Wayne, Indiana (SPE605-26-D-8506, $70,134,920); Pinnacle Petroleum Inc.,* Huntington Beach, California (SPE605-26-D-8507, $59,083,584); Campbell Oil Co.,* Elizabethtown, North Carolina (SPE605-26-D-8502, $39,494,290); GLA Global Co.,* Chicago, Illinois (SPE605-26-D-8504, $21,301,706); Gresham Petroleum Co.,* Indianola, Mississippi (SPE605-26-D-8505, $17,737,742); Virginia Transport LLC,* Chicago, Illinois (SPE605-26-D-8513, $11,591,274); and Potter Oil & Tire Co. Inc.,* Aurora, North Carolina (SPE605-26-D-8508, $9,601,395), have each been awarded a fixed-price with economic-price-adjustment, requirements contract issued against solicitation SPE605-25-R-0214 for various types of fuel. This was a competitive acquisition with thirty-five responses received. These are two-year eight-month contracts with no option periods. Locations of performance are Alabama, Arkansas, Florida, Georgia, Louisiana, Mississippi, Missouri, North Carolina, and South Carolina, with a Sept. 30, 2028, ordering period end date. Using customers are Army, Navy, Air Force, Marine Corps, Army National Guard, Air National Guard, Coast Guard, War Department, Defense Logistics Agency, Department of Justice, Federal Bureau of Investigation, Department of Health and Human Services, Department of Homeland Security, Department of the Interior, National Aeronautics and Space Administration, and the International Broadcasting Bureau and Social Security Administration. Type of appropriation is fiscal 2026 through 2028 defense working capital funds. The contracting activity is Defense Logistics Agency Energy, Fort Belvoir, Virginia.",
    "contractingActivity": "Defense Logistics Agency Energy, Fort Belvoir, Virginia",
    "serviceBranch": "DEFENSE LOGISTICS AGENCY",
    "isSmallBusiness": false,
    "rawParagraph": "Petroleum Traders Corp.,* Fort Wayne, Indiana (SPE605-26-D-8506, $70,134,920); Pinnacle Petroleum Inc.,* Huntington Beach, California (SPE605-26-D-8507, $59,083,584); Campbell Oil Co.,* Elizabethtown, North Carolina (SPE605-26-D-8502, $39,494,290); GLA Global Co.,* Chicago, Illinois (SPE605-26-D-8504, $21,301,706); Gresham Petroleum Co.,* Indianola, Mississippi (SPE605-26-D-8505, $17,737,742); Virginia Transport LLC,* Chicago, Illinois (SPE605-26-D-8513, $11,591,274); and Potter Oil & Tire Co. Inc.,* Aurora, North Carolina (SPE605-26-D-8508, $9,601,395), have each been awarded a fixed-price with economic-price-adjustment, requirements contract issued against solicitation SPE605-25-R-0214 for various types of fuel. This was a competitive acquisition with thirty-five responses received. These are two-year eight-month contracts with no option periods. Locations of performance are Alabama, Arkansas, Florida, Georgia, Louisiana, Mississippi, Missouri, North Carolina, and South Carolina, with a Sept. 30, 2028, ordering period end date. Using customers are Army, Navy, Air Force, Marine Corps, Army National Guard, Air National Guard, Coast Guard, War Department, Defense Logistics Agency, Department of Justice, Federal Bureau of Investigation, Department of Health and Human Services, Department of Homeland Security, Department of the Interior, National Aeronautics and Space Administration, and the International Broadcasting Bureau and Social Security Administration. Type of appropriation is fiscal 2026 through 2028 defense working capital funds. The contracting activity is Defense Logistics Agency Energy, Fort Belvoir, Virginia.",
    "parsingConfidence": 0.9,
    "isIDIQ": false,
    "isMultipleAward": false,
    "isHybridContract": false,
    "isCompeted": null,
    "isSmallBusinessSetAside": false,
    "isModification": false,
    "isOptionExercise": false
  },
  {
    "article_title": "Contracts For Nov. 28, 2025",
    "article_date": "2025-11-28",
    "article_url": "https://www.war.gov/News/Contracts/Contract/Article/4344447/",
    "vendorName": "TrillaMed LLC.",
    "vendorLocation": "Bingham Farms, Michigan",
    "vendorCity": "Bingham Farms",
    "vendorState": "Michigan",
    "awardAmount": 14920080,
    "awardAmountText": "$14,920,080",
    "contractDescription": "TrillaMed LLC., Bingham Farms, Michigan, was awarded a $14,920,080 firm-fixed-price delivery order (HT9425-25-FE073) against a previously awarded firm-fixed-price, indefinite-delivery/indefinite-quantity, competitively awarded contract to acquire autoclave systems and operating control systems at the U.S. Army Medical Research Institutes for Infectious Diseases, Fort Detrick, Maryland. Delivery is expected after award. Fiscal 2025 procurement funding in the amount of $11,974,344 was obligated at the time of the award; as well as $2,945,736 in fiscal 2025 operations and maintenance funds. The place of performance is Fort Detrick, Maryland. The Defense Health Agency, U.S. Army Medical Research Acquisition Activity, Contracts Branch 3, Fort Detrick, Maryland, was the contracting activity. (Awarded Sept. 29, 2025)",
    "serviceBranch": "ARMY",
    "isSmallBusiness": false,
    "rawParagraph": "TrillaMed LLC., Bingham Farms, Michigan, was awarded a $14,920,080 firm-fixed-price delivery order (HT9425-25-FE073) against a previously awarded firm-fixed-price, indefinite-delivery/indefinite-quantity, competitively awarded contract to acquire autoclave systems and operating control systems at the U.S. Army Medical Research Institutes for Infectious Diseases, Fort Detrick, Maryland. Delivery is expected after award. Fiscal 2025 procurement funding in the amount of $11,974,344 was obligated at the time of the award; as well as $2,945,736 in fiscal 2025 operations and maintenance funds. The place of performance is Fort Detrick, Maryland. The Defense Health Agency, U.S. Army Medical Research Acquisition Activity, Contracts Branch 3, Fort Detrick, Maryland, was the contracting activity. (Awarded Sept. 29, 2025)",
    "parsingConfidence": 0.9,
    "contractTypes": [
      "firm-fixed-price",
      "IDIQ"
    ],
    "isIDIQ": true,
    "isMultipleAward": false,
    "isHybridContract": false,
    "isCompeted": null,
    "isSmallBusinessSetAside": false,
    "isModification": false,
    "isOptionExercise": false
  }
]